text,A,B,C,D,ans,答题解析,判分规则
商品的价值是（          ）,由抽象劳动创造的,商品的自然属性,生产商品消耗的具体劳动,商品的社会属性,AD,,全对得分
资本主义劳动过程同其他劳动过程相比较体现出来的特点是（          ）,创造新的使用价值,创造新的价值,劳动产品归资本家所有,工人在资本家监督下劳动，其劳动属于资本家,CD,,全对得分
下列选项对资本主义意识形态理解正确的是（          ）,资本主义意识形态是资本主义社会条件下的观念上层建筑,资本主义意识形态是为资本主义社会形态的经济基础服务的,资本主义意识形态是资产阶级意识的集中体现,在资本主义国家中占统治地位的政治、经济、法律都属于资本主义意识形态范畴,ABCD,,全对得分
关于剩余价值规律下列说法错误的是（          ）,揭示了资本主义生产的目的和达到目的的手段,反映资本主义生产的实质,是商品经济的基本规律,伴随市场经济始终的经济规律,CD,,全对得分
货币的本质通过它的职能体现出来，货币有多种职能，其中最基本的职能是（          ）,价值尺度,流通手段,支付手段,贮藏手段和世界货币,AB,,全对得分
马克思指出“劳动力的价值也是由生产从而再生产这种特殊物品所必需的劳动时间决定的”。因此，劳动力商品的价值构成包括（          ）,维持劳动者生存所需要的生活资料价值,劳动者进行生产活动所必须的生产资料价值,养育子女所需要的生活资料价值,劳动者的教育和培训费用,ACD,,全对得分
对资本主义简单再生产过程分析的意义在于揭示（          ）,资本主义再生产过程中资本运动所采取的形式,可变资本是工人创造的价值的一部分,不仅可变资本而且全部资本都是工人的劳动创造的,工人的个人消费不过是为资本家再生产劳动力,BCD,,全对得分
马克思指出：“我们在这里最初看到的利润，和剩余价值是一回事，不过它具有一个神秘的形式，而这个神秘化的形式必然会从资本主义生产方式中产生出来。”恩格斯也指出：“马克思一有机会就提醒读者注意，决不要把他所说的剩余价值同利润或资本赢利相混淆。”这说明（          ）,利润是剩余价值的一种具体形式,剩余价值是利润的本质内容,剩余价值是资本的赢利,利润常常只是剩余价值的一部分,ABD,,全对得分
交换价值是（          ）,一种商品价值与另一种商品价值相交换量的关系或比例,一种商品使用价值与另一种商品使用价值相交换的量的关系或比例,商品价值的表现形式,商品使用价值的表现形式,BC,,全对得分
价值是（          ）,凝结在商品中的抽象劳动,商品的社会属性,交换价值的基础,反映商品生产者之间的关系,ABCD,,全对得分
下列选项关于商品的价值、使用价值以及交换价值的关系理解正确的是（          ）,使用价值是交换价值的物质承担者,价值是交换价值的基础,价值是使用价值的表现形式,交换价值是价值的表现形式,ABD,,全对得分
人类进入了21世纪，与马克思所处的时代相比，社会经济条件发生了很大的变化。因此，必须深化对马克思劳动价值论的认识。主要包括（          ）,深化对创造价值的劳动的认识,深化对价值创造与价值分配关系的认识,深化对科技人员、经营管理人员在社会生产和价值创造中所起的作用的认识,深化对科技、知识、信息等新的生产要素在财富和价值创造中的作用的认识,ABCD,,全对得分
在商品经济运行中，价值、价格、供求三者之间的关系是（          ）,价格受供求关系影响，围绕价值上下波动,价格受价值影响，随供求关系变化而变动,价格由价值决定，反映价值并反映供求关系,价格由价值决定，受供求关系影响又制约供求关系,ACD,,全对得分
关于资本主义工资的问题，下列说法正确的是（          ）,科学地区分劳动和劳动力是揭示资本主义工资本质的关键,资本主义工资的基本形式分为计时工资和计件工资两种,资本主义工资小于工人在生产劳动中创造的新价值,资本主义工资掩盖了雇佣工人的必要劳动和剩余劳动的区别,ABCD,,全对得分
使用价值和价值是商品的两个基本因素。当生产者把商品卖给消费者时，（          ）,生产者和消费者都得到了商品的使用价值和价值,生产者既实现了商品的使用价值，也实现了商品的价值,生产者实现了商品的价值，却让渡了商品的使用价值,消费者得到了商品的使用价值，却支付了商品的价值,CD,,全对得分
下列关于使用价值与价值的表述，正确的有（          ）,使用价值是永恒范畴，而价值是历史范畴,使用价值是商品的自然属性，而价值是商品的社会属性,使用价值是具体劳动创造的，而价值是由抽象劳动形成的,使用价值和价值既相互依存，互为前提，又相互对立,ABC,,全对得分
具体劳动和抽象劳动是生产商品的同一劳动过程的两个方面，二者的区别在于（          ）,具体劳动是劳动的具体形式，抽象劳动是一般的人类劳动,不同的具体劳动有质的不同，抽象劳动没有质的差别,具体劳动反映人与自然的关系，抽象劳动体现商品生产者之间的关系,具体劳动创造商品的使用价值，抽象劳动创造商品的价值,ABC,,全对得分
马克思指出，在商品经济中，价值规律是“作为起调节作用的自然规律强制地为自己开辟道路，就像房屋倒在人的头上时重力定律强制为自己开辟道路一样”。这表明（          ）,价值规律是商品经济的一般规律或基本规律,价值规律和自然规律一样具有强制性,价值规律具有自发性,价值规律排斥人的主观能动性,ABC,,全对得分
资本主义国家的对内职能主要有（          ）,对被统治阶级进行压迫和控制的政治功能,对邮政、铁路、水路、文教、卫生保健、社会福利等事业进行管理的公共管理职能,进行国际交往的职能,维护国家安全和利益的职能,AB,,全对得分
影响劳动生产率高低的主要因素有（          ）,科学技术的发展水平及其在工艺上的应用程度,劳动者技术的平均熟练程度,生产资料的规模和效能以及自然条件,生产过程中分工和协作的合理程度,ABCD,,全对得分
资本主义政治制度的历史和阶级局限性是（          ）,资本主义的民主是金钱操纵下的民主,法律名义上的平等掩盖了事实上的不平等,资本主义国家的多党制是资产阶级选择自己的国家管理者、实现其内部利益平衡的政治机制,制定和推行符合资产阶级利益的方针、政策,ABC,,全对得分
反映资本家对工人的剥削程度的公式是（          ）,剩余价值/可变资本,剩余价值/全部预付资本,剩余劳动时间/必要劳动时间,年剩余价值量/预付可变资本,AC,,全对得分
影响资本积累数量的因素有（          ）,对劳动力的剥削程度,社会劳动生产率的水平,预付资本量的大小,所用资本和所费资本之间的差额,ABCD,,全对得分
价格受市场供求的影响，围绕价值上下波动，不是对价值规律作用的否定，而是价值规律作用的表现形式，这是因为（          ）,商品交换都是按照价格与价值相一致的原则进行的,从商品交换的总体看，价格总额与价值总额是相等的,从商品交换的较长时间看，价格与价值是趋于一致的,各种商品价格的波动，是以各自的价值为基础的,BCD,,全对得分
“物以稀为贵，商品价值量的大小是由市场的供求关系决定的”，这种观点（          ）,正确揭示了决定商品价值量大小的根源,是正确的观点,否定了社会必要劳动时间对商品价值量大小的决定作用,是错误的观点,BD,,全对得分
简单商品经济中所包含的各种矛盾主要是（          ）,使用价值和价值的矛盾,价值和交换价值的矛盾,具体劳动和抽象劳动的矛盾,私人劳动和社会劳动的矛盾,ACD,,全对得分
绝对剩余价值生产和相对剩余价值生产的共同点（          ）,都体现着资本家对工人的剥削关系,都延长了剩余劳动时间,都增加了剩余价值量,都提高了剩余价值率,ABCD,,全对得分
资本主义生产过程是劳动过程和价值增殖过程的统一。在这一过程中，具体劳动（          ）,生产新的使用价值,创造剩余价值,转移劳动力的价值,转移生产资料的价值,AD,,全对得分
劳动力商品的价值包括（          ）,维持劳动者生存所需要的生活资料价值,劳动者维持生产所必需的生产资料价值,养育子女所需要的生活资料价值,劳动者的教育和培训费用,ACD,,全对得分
价值规律的内容和要求是（          ）,商品的价值量由生产商品的社会必要劳动时间决定,商品交换以商品的价值量为基础,商品交换必须实行等价交换,价格围绕价值上下波动,ABC,,全对得分
资本区分为不变资本和可变资本的意义在于（          ）,进一步揭示了剩余价值的真正源泉,为计算剩余价值率提供了科学依据,为计算资本周转速度提供了依据,为平均利润、生产价格理论奠定了基础,ABD,,全对得分
资本主义生产的结果是（          ）,生产出新的使用价值,转移了生产资料的价值,再生产劳动力的价值,创造出剩余价值,ABCD,,全对得分
剩余价值规律（          ）,揭示了资本主义生产的目的和达到目的的手段,反映资本主义生产的实质,在资本主义社会起主导作用,决定资本主义生产的主要方面和主要过程,ABCD,,全对得分
在新的历史条件下，与马克思所处的时代相比，深化对创造价值的劳动的认识主要有（          ）,劳动的科技含量和知识含量增加了,科技人员和管理人员的劳动在劳动总量中的比重增加了,农业劳动已成为物质生产劳动的基本形式,在总的劳动消耗量中物化劳动的比重增加而活劳动的比重相对减少了,ABD,,全对得分
单位商品的价值量和生产这种商品的（          ）,劳动生产率成正比,社会必要劳动时间成正比,劳动生产率成反比,社会必要劳动时间成反比,BC,,全对得分
纺织厂的资本家购买的用于生产的棉花属于（          ）,不变资本,固定资本,可变资本,流动资本,AD,,全对得分
在其他条件不变的情况下，资本有机构成的提高会导致（          ）,相对过剩人口的形成,利润率的提高,可变资本在总资本中比例的降低,资本周转速度的减缓,AC,,全对得分
商品是使用价值和价值的统一。这表明（          ）,缺少使用价值和价值任何一方面，都不能成为商品,没有使用价值就没有价值,有使用价值，但不是劳动产品，也不是商品,有使用价值，也是劳动产品，但只是供生产者自己消费，也不是商品,ABCD,,全对得分
以下对马克思的劳动价值论的说法正确的是（          ）,是对古典政治经济学劳动价值论的批判、继承和发展,是剩余价值理论的基础,是研究价值分配的理论,为揭示资本主义生产方式的本质奠定了理论基础,ABD,,全对得分
在资本主义现实中，剩余价值是采取各种转化形式出现的，它们有（          ）,成本,工资,利润,利息,CD,,全对得分
具体劳动和抽象劳动的区别是（          ）,具体劳动是劳动的具体形式，抽象劳动是一般人类劳动,具体劳动是体力劳动，抽象劳动是脑力劳动,具体劳动反映人与自然的关系，抽象劳动反映社会生产关系,具体劳动不是使用价值的唯一源泉，抽象劳动是价值的唯一源泉,ACD,,全对得分
为了追逐最大化的利润，资本家总是想方设法地进行资本积累，而资本积累的源泉是剩余价值。一般而言，资本积累规模的大小取决于,利用资本与所费资本之间的差额,劳动生产率的高低,资本家垫付资本的大小,资本家对工人的剥削制度,ABCD,,全对得分
资本主义制度从建立至今，经历了（         ）阶段,自由竞争资本主义,后资本主义,经济危机频发,垄断资本主义,AD,,全对得分
资本主义国家采用的微观规制的类型主要有（         ）,反托拉斯法,公共事业规制,社会经济规制,意识形态规制,ABC,,全对得分
对于输入国来说，资本输出的作用表现在（         ）,促进了输入国自然经济的瓦解和商品经济的发展,带动输入国建成一些经济发展所必需的基础设施,对输入国民族经济的发展没有任何益处,给输入国带来一系列社会经济问题,ABD,,全对得分
垄断资本向世界范围扩展的基本形式有（         ）,借贷资本输出,生产资本输出,商品资本输出,私人资本输出,ABC,,全对得分
社会主义代替资本主义是一个（         ）,长期的历史过程,隐蔽的历史过程,曲折的历史过程,复杂的历史过程,ACD,,全对得分
列宁根据他所处的时代的实践曾指出，资本主义发展到帝国主义，便具有五个基本特征，包括（         ）,垄断组织在经济生活中起决定作用,在金融资本的基础上形成金融寡头的统治,瓜分世界的资本家国际垄断同盟已经形成,最大资本主义大国已把世界上的领土瓜分完毕,ABCD,,全对得分
资本主义制度的历史进步性主要表现在（         ）,促使科学技术转变为生产力,追求剩余价值的动力和竞争的压力推动了生产力发展,资本主义政治制度促进和完善了资本主义生产方式,资本主义意识形态促进和完善了资本主义生产方式,ABCD,,全对得分
垄断资本主义本身发展所经历的阶段是（         ）,企业垄断资本主义阶段,行业垄断资本主义阶段,私人垄断资本主义阶段,国家垄断资本主义阶段,CD,,全对得分
经济全球化发展趋势的主要表现是（         ）,市场经济成为全球经济体制,区域经济集团化日益发展,跨国公司的主导作用增强,几乎所有国家都被卷入了市场经济潮流之中,ABCD,,全对得分
资产阶级推动改良主义的措施主要有（         ）,收买本国工人阶级中少数上层分子和工人领袖从内部分裂破坏工人运动,通过推行福利政策，举办多种福利事业来缓和阶级矛盾,推行“劳资合作”、“工人参加管理”等措施，来调动工人的积极性,宣扬“资本民主化”、“人民资本主义”思想,ABCD,,全对得分
垄断时期竞争的手段主要有（         ）,政治手段,经济手段,暴力手段,欺骗.讹诈和盗窃情报,ABC,,全对得分
国家垄断资本主义是（         ）,银行垄断资本和工业垄断资本融合或混合生长的资本,国家政权和私人垄断资本相结合的垄断资本,资本主义基本矛盾发展的产物,社会主义最完备的物质准备,BCD,,全对得分
金融资本（         ）,是垄断资本主义阶段居统治地位的资本,是在垄断基础上由银行垄断资本和工业垄断资本融合或混合生长而形成的新型资本,是自由竞争资本主义阶段所产生的资本,主要是通过“参与制”在政治领域里进行统治的资本,AB,,全对得分
与第二次世界大战之前的资本主义相比，当代资本主义生产关系中的社会阶层、阶级机构发生了许多新的变化。主要表现在（         ）,知识型和服务型劳动者数量随科技革命不断深入而持续地增加,资本家由从前的直接生产经营者变成了以剪息票为生的食利者,职工持股和参与决策使得劳动者成为资本家集团的重要力量,高级职业经理成为资本主义社会大公司经营活动的实际控制者,ABCD,,全对得分
空想社会主义与科学社会主义的根本区别在于（       ）,历史观不同,对资本主义制度的态度不同,实现理想的途径不同,依靠的社会力量不同,ACD,,全对得分
十月革命后列宁指出：“对俄国来说，根据书本争论社会主义纲领的时代已经过去了，我深信已经一去不复返了。今天只能根据经验来谈社会主义”。对这句话的正确理解是（       ）,在社会主义建设中经验比理论更重要,在社会主义建设过程中对纲领的讨论是无足轻重的,应该在实践中不断丰富发展社会主义理论,必须由实践来检验社会主义理论,CD,,全对得分
批判的空想社会主义在理论上的局限性在于（       ）,未能揭示资本主义必然灭亡的经济根源,看不到埋葬资本主义的力量,找不到通往理想社会的现实道路,不是科学的思想体系,ABCD,,全对得分
列宁关于社会主义理论的主要贡献包括（       ）,把社会主义建设作为一个长期探索、不断实践的过程,把大力发展生产力、提高劳动生产率放在首位,在过渡时期不能人为取消商品经济，而要利用商品货币关系发展经济,社会主义革命后可以利用资本主义的某些方法建设社会主义,ABCD,,全对得分
下列对空想社会主义的认识正确的是（       ）,它是一种批判、否定资本主义的思潮,它反映了早期无产阶级迫切要求改造现存社会、建立理想的新社会的愿望,它是早期无产阶级意识和利益的先声,就理论体系而言，它属于资产阶级的理论,ABC,,全对得分
在整个社会主义历史时期无产阶级专政的任务是（       ）,镇压一切反社会主义敌对势力的反抗与破坏，防止外敌侵略和颠覆,保护广大人民群众的合法权益,巩固作为社会主义经济制度基础的公有制，领导与组织社会主义建设,维护社会主义法制社会,ABCD,,全对得分
列宁在“政治遗嘱”中，提出了一系列关于社会主义的新构想，如（       ）,学习和利用资本主义一切有价值的东西,发展大工业，实现工业化和电气化,用合作社形式将农民引向社会主义道路,进行文化革命，大力发展文化教育事业,ABCD,,全对得分
空想社会主义理论的合理性表现在（       ）,它深刻揭露了资本主义的罪恶,它认为资本主义必须要被一种更好的制度取代,它揭示了资本主义必然灭亡的经济根源,它认为无产阶级是埋葬资本主义的革命力量,AB,,全对得分
一下陈述，属于资本主义国家对社会主义国家进行“和平演变”战略内容的有（       ）,通过强硬的军事、政治压力和有限制的经济、科技的合作，迫使社会主义国家屈从其经济政治发展战略的要求，并达到促使社会主义国家改变制度的目的,通过强大的文化机器和文化产品进行文化渗透，在社会主义国家内部制造经济、政治、思想等种种混乱,支持和操纵社会主义国家内部的反对力量,进行赤裸裸的军事侵略,ABC,,全对得分
马克思对阶级斗争学说的新贡献是（       ）,发现了社会上的阶级斗争，提出了阶级斗争学说,提出了人类社会史就是阶级斗争史的学说,发现阶级和阶级斗争的存在只同生产发展的一定历史阶段相联系,阶级斗争必然导致无产阶级专政,CD,,全对得分
社会主义实现模式多样化的原因在于（       ）,政治经济文化水平的发展不同,历史传统不同,指导思想不同,地域环境不同,ABD,,全对得分
在实现社会主义的自我发展与完善中要（       ）,以与时俱进的马克思主义理论为指导，坚持正确的改革方向,选择正确的改革方式与步骤，因地制宜，循序渐进,完全按照发达国家模式发展,妥善处理改革、发展与稳定的关系,ABD,,全对得分
对无产阶级专政和社会主义民主认识正确的是（       ）,无产阶级专政和社会主义民主是科学社会主义的核心内容,坚持无产阶级专政是建立和发展社会主义的政治保证,建设高度的社会主义民主，是工人阶级执政党为之奋斗的崇高目标和根本任务,无产阶级专政思想的诞生，是马克思主义科学思想体系形成的重要标志之一,ABCD,,全对得分
无产阶级专政的特征有（       ）,无产阶级专政是人类社会最后也是最进步的新型国家政权,无产阶级专政是工人阶级通过共产党领导的国家政权,无产阶级专政是以工农联盟为阶级基础的国家政权,无产阶级专政最终的目标是建立无阶级的社会,ABCD,,全对得分
空想社会主义的发展经历了哪些阶段（       ）,16—17世纪早期空想社会主义,18世纪的空想平均共产主义,19世纪初批判的空想社会主义,不成熟、不科学的空想社会主义,ABC,,全对得分
东欧剧变、苏联解体，最深刻的教训是（       ）,放弃了社会主义道路,放弃了无产阶级专政,放弃了共产党的领导地位,放弃了马克思列宁主义,ABCD,,全对得分
马克思主义政党的领导核心作用主要体现在（       ）,社会主义革命中,社会主义建设事业中,社会主义改革事业中,自发的群众运动中,ABC,,全对得分
社会主义发展道路多样性的原因有（       ）,各国生产力状况各不相同,各国历史传统各不相同,各国工业化程度各不相同,各国文化习俗各不相同,ABCD,,全对得分
坚持走中国特色社会主义道路的正确做法是（         ）,坚持解放思想、实事求是、与时俱进、求真务实，用于推进理论和实践创新,坚持以人为本，尊重人民主体地位，发挥群众首创精神，紧紧依靠人民推动改革,坚持正确处理改革发展稳定关系，胆子要大，步子要稳,坚持顶层设计和摸着石头过河相结合，整体推进和重点突破相促进，提高改革决策科学性，广泛凝聚共识，形成改革合力,ABCD,,全对得分
经济文化相对落后的国家建设社会主义之所以是长期的和艰巨的，是因为（       ）,商品经济不发达，生产力落后,封建主义传统长，缺乏近代民主的传统,社会主义国家从诞生之日起，就处在资本主义世界的包围之中，受到资本主义列强的遏制和扼杀,马克思主义执政党对社会主义发展道路和建设规律的探索是一个过程,ABCD,,全对得分
社会主义在曲折中发展是由以下哪些因素决定的（        ）,社会主义是新生事物，其成长不会一帆风顺的,社会主义社会的基本矛盾推动社会发展，是作为一个过程而展开的，人们对它的认识也有一个逐渐发展的过程,经济全球化对于社会主义的发展既是机遇又是挑战,社会主义本身难以解决的内在矛盾导致的,ABC,,全对得分
努力探索适合本国国情的社会主义发展道路，必须做到（        ）,必须坚持对待马克思主义的科学态度,必须从当时当地的历史条件出发，坚持“走自己的路”,必须充分吸收人类一切文明成果,照搬西方发达国家资本主义建设的模式,ABC,,全对得分
科学社会主义诞生的重大意义是（       ）,敲响了资本主义的丧钟,使工人阶级拥有了反对资产阶级的强大思想武器,指引一些国家的工人阶级进行革命，在本国建立了社会主义制度,资本主义在全世界的消亡成为现实,ABC,,全对得分
十月社会主义革命划时代的意义是（       ）,第一次把马克思主义关于无产阶级革命的理论变成了现实,冲破了世界帝国主义阵营，沉重打击了帝国主义资产阶级的统治,动摇了帝国主义殖民统治，推动了殖民地、半殖民地人民的解放斗争,促进了马克思列宁主义的传播，开创了世界社会主义运动发展的新局面,ABCD,,全对得分
社会主义作为人类社会历史发展中的崭新形态，其产生和发展（       ）,符合历史发展趋势,代表社会进步方向,体现着人类的未来,具有强大生命力,ABCD,,全对得分
社会主义的发展具有曲折性，但是，社会主义在曲折中持续前进，则是任何力量都不能扭转的历史趋势。这是因为（       ）,社会主义制度能够从根本上克服生产资料的资本主义私有制对生产力发展的束缚，为生产力的发展提供广阔的前景,社会主义的上层建筑完全适应经济基础的发展,社会主义符合广大人民的利益和愿望，能够得到人民的拥护和支持,社会主义能够在改革中不断实现自我发展和自我完善,ACD,,全对得分
《共产党宣言》提出，无产阶级取得政治统治以后的任务是（       ）,用革命的暴力镇压资产阶级的反抗,一步步地夺取资产阶级的全部资本，彻底消灭私有制,把全部生产资料集中在国家手中，使国家有计划地组织生产,大力发展生产力，尽快增加生产力的总量,ABCD,,全对得分
列宁认为社会主义可能首先在帝国主义链条中的薄弱环节突破。这里“薄弱环节”的含义包括（       ）,资本主义有一定程度的发展,各种社会矛盾极其尖锐,无产阶级的组织程度和觉悟程度比较高,资产阶级统治比较薄弱,ABCD,,全对得分
